{
  "$schema": "schemas/distribution-policy.schema.json",
  "schema": "zaereo.distribution-policy/v1",
  "policy_id": "zaereo-phase-zero-fail-closed",
  "revision": 1,
  "policy_status": "active-fail-closed",
  "review": {
    "reviewed_at": "2026-07-13T00:00:00+01:00",
    "reviewer": "ZaeREo Phase-0 engineering review",
    "authority": "engineering-containment-only",
    "rights_clearance": false,
    "valid_until": null,
    "revisit_condition": "Replace or revise this baseline only after component-specific rights evidence, an exact channel review, and maintainer or qualified legal approval are recorded together.",
    "notes": "This review establishes a conservative containment policy. It is not a legal opinion, copyright-holder permission, or release approval."
  },
  "code_distribution_permitted": false,
  "media_distribution_permitted": false,
  "public_gameplay_tree_permitted": false,
  "public_distribution_enabled": false,
  "evidence": [
    {
      "id": "asset-inventory",
      "kind": "repository-audit",
      "path": "docs/audits/assets.json",
      "locator": "checked-in effective Zaero asset identity inventory",
      "observed_on": "2026-07-13",
      "supports": "Identifies runtime media without granting permission to distribute it."
    },
    {
      "id": "asset-sources-policy",
      "kind": "provenance-record",
      "path": "docs/provenance/ASSET_SOURCES.md",
      "locator": "Current policy and Records still required",
      "observed_on": "2026-07-13",
      "supports": "Records that source and media gates are independent, tools-only requires a history-clean root, and local-full is permanently private."
    },
    {
      "id": "baseline-manifest",
      "kind": "source-baseline",
      "path": "docs/provenance/baselines.json",
      "locator": "generated supplied-tree identities",
      "observed_on": "2026-07-13",
      "supports": "Provides hashes for supplied comparison trees while explicitly leaving authoritative origins unresolved."
    },
    {
      "id": "roadmap-d003",
      "kind": "roadmap-decision",
      "path": "docs/ZAERO_PORT_ROADMAP.md",
      "locator": "Sections 7.5 and 12, decision D-003",
      "observed_on": "2026-07-13",
      "supports": "Defines fail-closed component, mode, repository, CI, source-archive, and release-channel policy."
    },
    {
      "id": "roadmap-readiness",
      "kind": "roadmap-decision",
      "path": "docs/ZAERO_PORT_ROADMAP.md",
      "locator": "Section 13.11 Machine-readable release readiness",
      "observed_on": "2026-07-13",
      "supports": "Defines non-promotable readiness profiles and the non-waivable release gates."
    },
    {
      "id": "root-gpl-text",
      "kind": "license-text",
      "path": "LICENSE",
      "locator": "GNU General Public License version 2",
      "observed_on": "2026-07-13",
      "supports": "Contains the GPL-2.0 text; its presence does not establish that every repository addition was licensed by its holder."
    },
    {
      "id": "third-party-notices",
      "kind": "notice",
      "path": "THIRD_PARTY_NOTICES.md",
      "locator": "Zaero source additions; Zaero maps and media; dependency notices",
      "observed_on": "2026-07-13",
      "supports": "Records observed upstream and dependency licenses, unresolved Zaero rights, and required exact notice harvesting."
    }
  ],
  "components": [
    {
      "id": "combined-gameplay-source",
      "kind": "zaero-code",
      "description": "The Rerelease gameplay DLL tree with Zaero-derived behavior and integration changes intermingled with the upstream substrate.",
      "selectors": {
        "exact_paths": [],
        "narrow_globs": [
          "src/**"
        ],
        "external_inputs": []
      },
      "holder": "Mixed upstream holders and unresolved holders of Zaero-derived additions",
      "license": {
        "spdx_expression": null,
        "no_grant": true
      },
      "distribution_status": "unknown",
      "evidence_refs": [
        "baseline-manifest",
        "root-gpl-text",
        "third-party-notices"
      ],
      "reviewer": "ZaeREo Phase-0 engineering review",
      "jurisdiction_scope": "All public source and binary distribution channels; no jurisdiction-specific grant is recorded.",
      "expires_at": null,
      "revisit_condition": "Record a holder-authorized license or permission for every Zaero-derived source addition and verify compatibility with the complete GPL-covered work.",
      "notes": "GPL-2.0 coverage of the upstream substrate is not treated as a grant for unrelated or intermingled commercial additions."
    },
    {
      "id": "rerelease-reference-material",
      "kind": "substrate-source",
      "description": "Checked-in Rerelease reference material and the unresolved provenance identity used to reconstruct the upstream baseline.",
      "selectors": {
        "exact_paths": [],
        "narrow_globs": [
          "references/rerelease/**"
        ],
        "external_inputs": []
      },
      "holder": "id Software and other upstream contributors; exact imported-origin record pending",
      "license": {
        "spdx_expression": null,
        "no_grant": true
      },
      "distribution_status": "unknown",
      "evidence_refs": [
        "baseline-manifest",
        "root-gpl-text",
        "third-party-notices"
      ],
      "reviewer": "ZaeREo Phase-0 engineering review",
      "jurisdiction_scope": "All public repository and source-archive channels.",
      "expires_at": null,
      "revisit_condition": "Pin the official upstream commit/archive, verify every imported file and notice, and record the applicable SPDX decision.",
      "notes": "The observed GPL text is evidence, but the current baseline record still names a supplied local tree rather than a pinned official origin."
    },
    {
      "id": "gameplay-tests-and-audits",
      "kind": "zaero-code",
      "description": "Compatibility tests and source-derived audit records that encode detailed Zaero behavior or supplied-source facts.",
      "selectors": {
        "exact_paths": [
          "docs/audits/source-delta.json",
          "docs/audits/source-delta.md"
        ],
        "narrow_globs": [
          "tests/compatibility/**",
          "docs/compatibility/**"
        ],
        "external_inputs": []
      },
      "holder": "ZaeREo contributors and unresolved holders of any protectable Zaero-derived expression",
      "license": {
        "spdx_expression": null,
        "no_grant": true
      },
      "distribution_status": "unknown",
      "evidence_refs": [
        "roadmap-d003",
        "third-party-notices"
      ],
      "reviewer": "ZaeREo Phase-0 engineering review",
      "jurisdiction_scope": "All public repository, source-archive, CI, and release channels.",
      "expires_at": null,
      "revisit_condition": "Complete file-by-file authorship and protectable-expression review together with the gameplay source rights decision.",
      "notes": "Facts and original tests may be distributable on a different basis, but no blanket conclusion is encoded here."
    },
    {
      "id": "zaero-runtime-media",
      "kind": "media",
      "description": "Original Zaero maps, models, textures, images, sounds, sprites, cinematics, configuration, and other runtime media supplied by a user's installation.",
      "selectors": {
        "exact_paths": [],
        "narrow_globs": [
          ".install/imported/zaereo/**",
          "dist/*-local-full-private.zip"
        ],
        "external_inputs": [
          "Legitimate local Zaero installation: pak0.pak, pak1.pak, pak2.pak, and the nine documented loose runtime files"
        ]
      },
      "holder": "Unresolved Zaero media copyright holders",
      "license": {
        "spdx_expression": null,
        "no_grant": true
      },
      "distribution_status": "unknown",
      "evidence_refs": [
        "asset-inventory",
        "asset-sources-policy",
        "third-party-notices"
      ],
      "reviewer": "ZaeREo Phase-0 engineering review",
      "jurisdiction_scope": "All project-operated public hosting, CI, source, editor, and release channels.",
      "expires_at": null,
      "revisit_condition": "Record holder identity and specific permission covering exact works, modification, hosting, sublicensing, attribution, and intended channels.",
      "notes": "Known hashes prove identity only. The current permitted operation is local import from a legitimate user installation, not project redistribution."
    },
    {
      "id": "zaero-runtime-definitions",
      "kind": "definition",
      "description": "Zaero episode configuration, mapdb fragment, and editor entity definitions.",
      "selectors": {
        "exact_paths": [],
        "narrow_globs": [
          "pack/**",
          "editor/**"
        ],
        "external_inputs": []
      },
      "holder": "ZaeREo contributors; derivation and redistribution scope not yet reviewed file by file",
      "license": {
        "spdx_expression": null,
        "no_grant": true
      },
      "distribution_status": "unknown",
      "evidence_refs": [
        "roadmap-d003",
        "third-party-notices"
      ],
      "reviewer": "ZaeREo Phase-0 engineering review",
      "jurisdiction_scope": "Public runtime packages and editor-gamepack channels.",
      "expires_at": null,
      "revisit_condition": "Complete authorship, derivation, and license review for every shipped definition and generated editor output.",
      "notes": "Generated editor forms do not acquire a distribution grant merely because their generator is present."
    },
    {
      "id": "independent-tools-candidate",
      "kind": "tool",
      "description": "The three standard-library acquisition, PAK, and runtime-validation scripts proposed for a future tools-only artifact.",
      "selectors": {
        "exact_paths": [
          "tools/import_legacy_assets.py",
          "tools/make_pak.py",
          "tools/validate_runtime.py"